Recruiters are responsible for identifying and processing desirable candidates to fill job openings. These human resources specialists screen and interview candidates, serve as liaisons between employers and applicants, and facilitate job offers. Recruiters typically handle the following tasks: 
Receptionists manage the front desk of an organization or business. They handle administrative tasks, including greeting visitors and answering the phone. Since a receptionist is often the first person to interact with customers and visitors, they have a responsibility to make a professional and courteous first impression. In some organizations, receptionists have a role in security by restricting visitor access or notifying a security team of potential incidents. Receptionists may also manage communications by forwarding calls, maintaining internal calendars and helping visitors reach their destination in the office. 
A receiving clerk unloads delivery shipments and compares packing lists to purchase orders to ensure accurate deliveries. They are also responsible for packaging products for return to vendors. Some other duties of this role include: 
A realtor is a real estate professional who is hired to help and offer guidance to clients as they buy, sell or rent a residential or commercial property. Though similar to a real estate agent, a realtor is a member of the National Association of Realtors (NAR) and is expected to adhere to its ethics code.  
 
 
A radiology technician, also referred to as a radiographer, is a medical specialist who takes images of the internal organs, bones and tissue of the human body for diagnostic purposes. Physicians use these images to detect and treat medical conditions like broken bones or cancer, as well as for screening tests, such as mammograms. The technology that radiology technicians use for imaging may include: 
Radiologists are specialized physicians who assess, diagnose and treat patients using imaging technologies. The most common tool they use is the X-ray machine, which they use to take pictures of the body using beams of radiation. They also frequently use CT scans to take cross-sectional X-rays of the body. There are three different kinds of radiologists: diagnostic radiologists, interventional radiologists and radiation oncologists. Diagnostic radiology refers to the non-invasive image scans that are used to create detailed images of an area for diagnostic purposes. Interventional radiology uses imaging to diagnose and treat problems with blood vessels and lymph vessels. Radiation oncologists are physicians who specialize in treating cancer with ionizing radiation. 
A radiologic technologist is a health care professional with expertise in the proper use and deployment of diagnostic imaging scans, such as MRIs, X-rays and CTs. A radiologic technologist uses these technologies in producing accurate diagnostics and treatment plans for patients suffering from a variety of conditions. Some of the duties radiologic technologists typically have are: 
Radiation therapists administer radiation treatments to cancer patients. They run linear accelerator machines that deliver X-rays to shrink or get rid of cancer cells in the body. Radiation therapists work closely with cancer treatment teams that include radiation oncologists (cancer doctors), oncology nurses and dosimetrists (professionals trained to calculate radiation dosages). Their responsibilities might include: 
A quality inspector sets and maintains standards for product quality while also ensuring that procedures are in place to assure compliance with those standards. The typical duties for a quality inspector include: 
A quality engineer oversees an organization’s manufacturing and engineering processes by ensuring the proper use of tools, materials and procedures. They also work with the quality team to create and maintain standards for manufactured products. Other tasks a quality engineer may perform include: 
A quality control inspector ensures products are safe and meet the manufacturer’s guidelines before they leave the facility. They review each product to certify they are uniform and that customers will receive a standard and satisfactory product. Some duties of a quality control inspector include: 
A purchasing assistant is responsible for negotiating with vendors placing orders for business needs, often under the supervision of a buyer or purchasing manager. Many purchasing assistants are tasked with monitoring product inventory and anticipating needs based on quarterly and annual numbers. They typically maintain relationships with vendors and stay up-to-date on current industry trends. Purchasing assistants also: 
Purchasing agents procure supplies, equipment and services for a company to perform business operations. The duties and responsibilities of a purchasing agent may include: 
A pulmonologist is a doctor who focuses on the lungs and respiratory tract. A pulmonologist trains in internal medicine, concentrating on the cardio-pulmonary system and the lungs. A pulmonologist treats the lungs, blood vessels, heart and other related organs that aid in breathing. Pulmonologists may treat illnesses and diseases of the chest and lung, such as asthma, pneumonia, emphysema, tuberculosis and chest infections. They may also suggest lifestyle changes and coping strategies to minimize dependence on medication. Responsibilities of a pulmonologist include: 
A publicist acts as a liaison between the client and the public, working to promote their public image. A publicist manages the public image of their clients and sets up publicity events. They may also pitch ideas and content to clients, journalists and influencers. 
Psychotherapists are highly trained healthcare professionals who evaluate and treat patients with mental health issues. Psychotherapists can treat depression, anxiety, stress, phobias, behavioral or relationship problems and psychosomatic disorders. During therapy sessions, psychotherapists must listen to their clients carefully and with compassion to develop personalized treatment plans. 
A psychologist is a clinical professional with expertise in the diagnosis, prevention and treatment of mental health conditions. Some duties psychologists typically have are: 
A psychiatrist is a medical doctor with expertise in the diagnosis, prevention and treatment of mental health disorders. Some of the duties psychiatrists typically have are: 
A prosecutor is a legal representative of the government responsible for presenting evidence against suspects in the criminal court of justice. They work with police officers or other law enforcement personnel to bring criminals to justice. Prosecutors serve both the government and the people and must act within the law. The conduct of a prosecutor determines how safe the people are in a state. Prosecutors can be referred to as prosecuting attorneys, state attorneys, district attorneys or city attorneys. 
A project engineer manages a team during the entire lifecycle of a technical or engineering project. This professional ensures the design, consistency and functionality of a project throughout its execution. While their duties and responsibilities vary depending on the industry, project engineers typically perform the following tasks: 
A project coordinator performs administrative tasks that support a project manager and ensures that projects are completed on schedule and within budget. You may be involved with specific projects, or you could support the business in its entirety. You can find project coordinators in a diverse range of organizations from architecture firms, agricultural businesses, technology firms, healthcare and construction. Duties of a project coordinator could include: 
A programmer analyst designs technology solutions for organizations. They gather information about a company’s current system and how its needs are not being met. Programmer analysts then propose designs that will meet the needs of the organization. Many also then write the software code for the system, although some may direct a team of programmers to complete this final step. Specific responsibilities for the programmer analyst may include: 
Program coordinators handle human resources and administrative tasks, though their exact roles and responsibilities vary widely by industry. Program coordinators are typically employed by a variety of organizations, including educational, healthcare or assisted living facilities. They organize, implement and execute programs, and typically handle the following tasks: 
Program assistants provide administrative and logistical support to program managers and other team members. Tasks include answering phone calls and emails, processing financial documents, maintaining records, booking flights and accommodation and coordinating team activities such as meetings and workshops. Apart from these administrative responsibilities, program assistants may also perform program research and report client concerns to appropriate team members. In addition, program assistants could also assist with: 
A program analyst, often known as a research analyst or program evaluator, is a professional responsible for assessing an organization’s programs to determine if they are effective and efficient. This is accomplished through research, data gathering and similar methods. 
A production worker helps create, assemble and test products or their parts. They may also test the parts or finished products they create to ensure they meet specifications, quality and safety standards. Production workers usually work as part of an assembly line at a factory or manufacturing facility. Duties for production workers vary according to their industry and workplace, but often include: 
 
 
A process engineer is responsible for the equipment, system and methods used in a manufacturing facility to transform raw ingredients to their final product form. This position is responsible for the smooth operation of production facilities, plants and factories, and often requires a mix of scientific and administrative skills. Some process engineer duties include: 
A probation officer works with law offenders who are serving community-based sentences to ensure they satisfy judges’ requirements during their probationary periods. These members of the criminal justice system visit individuals on probation, supervise their activities and create reports on their progress. Common probation officer duties include: 
The school principal, also known as the headmaster or headteacher, is responsible for running a school’s daily administration. Principals supervise teachers, staff and students; help to develop and approve curriculums; and set the vision for the school. Ultimately, the principal is responsible for providing a safe and productive learning environment for the students. 
A preschool teacher cares for and teaches basic social, problem-solving and language skills to children under the age of 5. They teach these concepts, both one-on-one and in groups, using techniques such as games, storytelling, experimenting, art, music and play. Preschool teachers are responsible for preparing young children mentally and socially for kindergarten. Other preschool teacher duties might include: 
 
A porter works as a part of the maintenance team of a large guest-service organization, such as a shopping mall or hotel. Their responsibilities vary depending on their employer, but some duties may include: 
Police officers maintain public order by preventing crime, arresting criminals and protecting lives and property. Responsibilities may vary depending on the specific position and experience level, but all police offers are expected to write reports and keep detailed records. They may also be required to testify in court. Other responsibilities may include: 
Podiatrists are doctors that diagnose and treat foot and ankle injuries and conditions. The issues they might treat include sprains, fractures, arthritis, warts, corns, calluses, cysts, ingrown toenails, bone spurs, flat feet, deformities, diabetes complications and more. Some podiatrists also perform surgery, while others choose to specialize in a certain area, such as sports medicine, pediatrics, dermatology or geriatrics. Podiatrists’ job responsibilities might include: 
Plumbers install, maintain and repair residential and commercial plumbing systems that supply the property with water and gas and carry away waste. The key responsibilities of a plumber typically include:  
Plastic surgeons are licensed medical doctors who perform reconstructive and cosmetic procedures. Plastic surgeons may work on any area of the body in general or may specialize in a particular area, such as the face or hands. Plastic surgeons may administer cosmetic procedures to restore the patient’s appearance following an accident, disease or cancer, or they may treat the bones of the skull or face. 
Physiotherapists restore function and movement in people affected by injury, disability or illness. Among the methods used by physiotherapists are exercise, manual therapy, clinical advice and education. Physiotherapy is based on a “whole person” approach to health improvement and well-being, with particular attention given to the patient’s lifestyle. It is a science-based discipline that relies heavily on the patient’s involvement in their own care. 
A physicist is a scientist who researches and explores the laws controlling the natural world. They apply their knowledge of physics to achieve theoretical or practical goals, such as advancing humanity’s understanding of the way the world works and developing new medical technologies. Physicists typically specialize in a subfield such as astrophysics, biological physics or polymer physics. Their tasks vary depending on their employer and area of research, but can include: 
The relationship between the physician and the physician assistant complements and encourages the delivery of superb levels of patient care. A physician assistant requires an advanced level of education that mirrors the education of a physician. To practice as a physician assistant, you must be certified and licensed by your state. This means the PA can care for patients with substantial freedom. 
A physician provides medical care and treatment for patients. Physicians, who may also be referred to as doctors or medical practitioners, treat physical, mental and emotional issues. They can specialize in a range of areas, which will determine what type of care and treatment they provide. 
A physical therapy assistant is a healthcare professional responsible for carrying out patient treatment plans under the supervision of a physical therapist. They help with a variety of tasks, including showing patients how to perform exercises, using modalities on them and educating them about their injuries. Modalities are instruments of energy that may make physiological changes, such as ultrasounds, moist heat, ice, stimulation of muscles or traction devices. Physical therapy assistants also spend time documenting each treatment session accurately and may need to submit their treatment notes to insurance companies. 
A physical therapist assistant aids the primary physical therapist in helping patients overcome disabilities or injuries. They use advanced skills to encourage rehabilitation following an injury or illness. Physical therapist assistants may also work with patients who have chronic disabilities to improve their quality of life. Physical therapist assistants may have the following responsibilities: 
 
A phlebotomist is a health care professional who has been specially trained to draw blood. The blood is used to test for conditions based on a physician’s orders, although it can also be used for a transfusion, for research or for a donation. Some common duties of phlebotomists include: 
A pharmacy technician (PT) supplies patients with prescribed and over the counter medicines and manages the pharmacy inventory under the supervision of a licensed pharmacist. They perform duties that assist the pharmacist, such as answering the telephone, ordering medications and working with insurance companies to obtain payments. 
Pharmacologists conduct research to develop chemical compounds and substances used as new medications. Some pharmacologists focus on the effects of harmful chemicals, while others research the effects of chemicals on specific regions of the body, such as the respiratory or cardiovascular system. Pharmacologists can work in applied or clinical fields. Job duties include: 
A pharmacist is a clinical professional with expertise in various medications, including what they treat, their interactions and how to properly prescribe them. Some of the duties pharmacists typically have include: 
A petroleum engineer develops and designs systems to efficiently extract oil and gas from beneath the Earth’s surface. This field of engineering contributes to powering many other industries in the world. One of the goals of a petroleum engineer is to design oil drills and rigs that will help make the fossil fuel industry more environmentally sustainable.  
Personal trainers guide individuals and small groups through workouts and exercise routines. They assist people with cardiovascular and strength training exercises in an effort to help them achieve health and fitness goals. Personal trainers are usually responsible for the following tasks: 
Personal assistants provide support and manage tasks. They assist private clients in residential settings and professionals in office settings. They are usually responsible for: 
A perfusionist operates the cardiopulmonary bypass machine to assist a physician during cardiac surgery. The perfusionist is an important part of the medical team who assists with monitoring the health of the patient and taking action if needed. Perfusionists must comfortably work in stressful environments. The patient’s vitals can change in minutes, requiring the perfusionist to use their knowledge and training to adjust the machine. A perfusionist may have the following responsibilities: 
A pediatrician is a doctor who specializes in caring for and treating children from birth until age 18. They’re highly trained in assessing, preventing and treating issues that might affect children. They focus not only on the physical health of infants, children, adolescents and young adults, but also on emotional and social health. This could include treating children for common illnesses and infections, performing routine evaluations and well-child exams or talking to parents about behavioral issues. Other specific responsibilities of pediatricians include: 
Payroll specialists oversee all aspects of timesheet and payroll processing to ensure payroll processing remains compliant, accurate and on-time. Specific responsibilities may vary based on the size of the company the payroll specialist works for and the industry of the company, but typically include:  
Payroll clerks collect and organize employee timesheets and enter information to ensure employees are paid accurately and on time. Specific responsibilities may vary based on the size of the company the payroll clerk works for and the industry of the company, but typically include:  
A patient care technician is a health care professional who supports nurses, doctors and other medical staff in caring for patients during hospital stays or other visits. Patient care technicians observe, catalog and communicate needs and concerns to medical staff while reporting any changes in status to the patient’s care team. These professionals are responsible for making patients feel comfortable and cared for, which often requires them to provide emotional support and guidance to patients during their hospital stay or clinic visit. Some additional responsibilities of a patient care technician may include: 
Patient advocates help people navigate the complexities of the healthcare industry. This could include helping patients with administrative tasks like reviewing insurance claims and medical bills for accuracy and completeness and helping them dispute insurance claim denials. It could also include helping patients understand difficult diagnoses and treatment options, reviewing prescriptions and medications to ensure there are no conflicts and helping patients make difficult medical decisions. Some of the other responsibilities of patient advocates include: 
A pathology assistant, or pathologists’ assistant, works directly with a pathologist to examine and report information about surgical specimens. Along with the pathologist, a pathology assistant examine specimens and takes samples to test, analyze and better understand them. Some pathology assistants may also help with diagnosis by evaluating human organs or biopsies. A pathology assistant may have the following responsibilities: 
A pathologist is a medical doctor with a dedication to studying the causes, indicators, cures and effects of various diseases. Some of the duties pathologists typically have include: 
 
A pastor is an ordained member of the clergy of a Christian religious denomination who is responsible for leading a congregation. After ordination, a pastor is appointed to lead and counsel a particular parish, church or community. They provide moral, spiritual, personal and religious guidance to their parishioners. The specific duties of a pastor vary widely based on their religious denomination, the needs of the community and the style of the church. Some of the duties of a pastor may include: 
Parole officers monitor former offenders after their release from prison. They help parolees reintegrate into society by providing them with job assistance and rehabilitation resources. Parole officers perform the following tasks: 
A park ranger is a recreation professional who supervises state and national parks and monuments. Their central duty is ensuring visiting patrons follow laws and remain safe. They may serve in very specific capacities, such as security, maintenance and conservation, education and emergency response. Some of their responsibilities include: 
A paramedic provides professional medical services to people in emergencies. They administer care and attempt to stabilize the patient until they arrive at the hospital. Paramedics must know how to evaluate a patient’s condition and quickly make vital decisions regarding their medical care. They often work under large amounts of pressure and must remain calm and think clearly. Paramedics may alternate between caring for a patient in the ambulance and driving an ambulance to the hospital. 
A paralegal is a legal professional who performs a variety of work for a lawyer. Paralegals help lawyers prepare for trials, depositions and hearings and assist with preparing closing documents for cases. Their tasks vary depending on the size of their firm, but commonly include: 
A paleontologist is a scientist who studies fossils and contributes to research on their historical, sociological and archeological impacts. These professionals often specialize in a specific era or type of fossil, which may impact some of their typical tasks. Common responsibilities include: 
An outside sales representative meets and sells to customers in the field. While a general sales representative may communicate primarily over the phone or through the internet, an outside sales representative spends the majority of their time holding in-person meetings with customers. Those in this position are generally responsible for the following tasks: 
An orthopedic surgeon diagnoses, treats and operates on patients with musculoskeletal issues or injuries. These conditions might involve bones, nerves, joints, ligaments, tendon, muscles, tumors and more. Some orthopedic surgeons specialize in one area, such as hands, feet, joints, spine, sports medicine or oncology. Orthopedic surgeon responsibilities include: 
Orthodontists are specialized dentists who diagnose and treat dental issues, such as misaligned teeth and jaws. They use a variety of implements with patients, including braces, headgear and retainers. Orthodontists are responsible for the following tasks: 
Optometrists conduct eye examinations and diagnose and treat visual problems. An optometrist may do a combination of the following tasks: 
Opticians fit people with prescription eyeglasses and contact lenses. They assist customers with choosing appropriate frames and lenses. Opticians perform the following tasks: 
Ophthalmologists diagnose and treat vision problems. They are qualified to perform surgery on the eyes. An ophthalmologist may do a combination of the following tasks: 
An operations coordinator assists management in the day-to-day operations of the organization. They monitor and evaluate progress toward goals, including both operational and customer goals. An operations coordinator may have the following responsibilities: 
Operations analysts help companies solve internal problems and implement goal-oriented strategies. They use mathematical models and statistical analysis to evaluate problems, calculate risk and forecast outcomes. No matter their industry, operations analysts typically handle the following responsibilities: 
An oncologist is a physician who assesses, diagnoses and treats patients with cancer. There are three main types of oncologists classified according to their preferred treatment option: medical, surgical and radiation. Oncologists may further specialize in treating certain types of cancers, such as blood cancers or certain types of patients, such as children or seniors. Oncologists collaborate with other physicians, nurses and health care workers to give their patients the best health outcomes. Common duties for oncologists include: 
