Dog trainers work with dogs to teach them basic obedience, and in some cases, advanced performance activities. Some dog trainers may work primarily with dogs to correct behavior, and others may work with dogs to prepare them for shows or competitions. Some dog trainers may also be responsible for training and preparing service dogs to assist humans with medical or mental health needs. A dog trainer may have the following responsibilities: 
Doctors, also known as physicians, provide treatments, diagnoses and counseling to patients with illnesses, injuries or diseases. Some doctors work in specialties, such as cardiology, neurology and surgery. Doctors can also work as general practitioners, meaning they may assess patients with a variety of symptoms. 
 
Dietitians use food and nutrition to help patients manage acute and chronic health concerns. As diet and nutrition experts, they advise patients about what to eat to address health issues or maintain a healthy lifestyle. They are responsible for the following tasks: 
A dietary aide works in food preparation in healthcare facilities, hospitals or retirement homes. A dietary aide is a primary person responsible for preparing a healthy meal for a resident and being mindful of dietary restrictions, allergies and special concerns. Often a dietary aide will work directly with or for a dietitian to create and administer specific diet plans. 
 
A dialysis technician is a medical professional who specializes in helping individuals with kidney disorders that require the use of a dialysis machine. The dialysis technician helps in the administration of dialysis treatments by monitoring the process and making adjustments as needed for the safe application of the therapy. Other duties a dialysis technician is likely to have include: 
A DevOps (development operations) engineer facilitates communication between the developmental and operational sides in software development. A DevOps engineer makes it easier for the two sides to share feedback to make a more streamlined process, which decreases the time required for development. Responsibilities that a DevOps engineer might perform include: 
A detective researches and finds evidence to help solve criminal cases. They may need to respond to emergency calls at any hour of the day and arrest suspects. Detectives can also gather evidence from the scene of a crime and process it to use in a criminal case. They communicate with a variety of people including other law enforcement, emergency personnel and the public. 
A desktop support specialist is an information technology (IT) professional who maintains computer hardware and software systems. They’re responsible for installing new programs, managing updates and providing technical support. Responsibilities typically include: 
Design engineers use computer-aided design (CAD) software to develop, test and improve manufacturing processes and product designs. They often work in teams to boost the functionality of a company’s products and advance the methods by which they are made. Design engineer duties include: 
A dermatologist is a doctor that specializes in treating skin, nail, hair and mucous membrane-related conditions. These physicians may also assist patients with cosmetic issues by helping them repair and revitalize their skin, hair or nails. They treat a wide variety of conditions such as, vitiligo, eczema, dermatitis, acne and fungal infections. A dermatologist’s tasks may include: 
Dentists are doctors who specialize in oral care, treating problems with patients’ teeth, gums and other parts of the mouth. They provide instruction to parents on taking care of the teeth and gums, remove decay and fill cavities and repair or remove teeth that are damaged. They also diagnose oral diseases. Some doctors may perform surgical procedures on the bones, teeth or soft tissues. Other responsibilities include:  
Dental hygienists examine and clean patients’ teeth. They typically offer preventive care to help patients avoid oral diseases, and they also teach patients about maintaining good oral health. Dental hygienists perform the following tasks: 
Dental assistants are healthcare professionals who assist dentists in completing all dental-related tasks, including examining, cleaning and repairing teeth. A dental assistant may have the following responsibilities: 
A database administrator (DBA) manages and maintains software databases, such as client records, statistical surveys, census information, user accounts and library catalogs. A database administrator provides secure access to databases and manages backup solutions to prevent loss of data in the event of system failure. These individuals may also help develop stages of a database system. 
Data scientists analyze raw data and synthesize it into results that can be easily understood. This relatively new career path merges programming, statistics and business logic and data scientists use their skills in programming, statistics and machine learning to analyze the data and use it for form conclusions. They may work in social media companies and use the user data to understand habits and suggest content that the users will enjoy. They may also work in politics and make predictions about the election results. In general, data scientists use the data from their analyses to solve real-world problems in business and politics. Some of their primary duties include: 
A data entry clerk is an administrative professional who handles routine clerical tasks relating to entering or updating data in a computer system. A data entry clerk’s main responsibility is to ensure that the organization’s database is accurate and up-to-date. Data entry clerks may also assist accounts receivable with duties like processing invoices for payout and reviewing and processing order returns. Some additional responsibilities may include: 
Data architects help companies manage, store and secure their data. They work with upper-level management, computer engineers and other relevant professionals to assess data needs and create systems that help a company optimize its data. Data architect duties include: 
Data analysts organize and interpret large amounts of data for others to easily understand. Business professionals use this interpreted data to make business decisions. Data analysts also have the following responsibilities: 
A cybersecurity analyst assesses digital security risks for a company and makes suggestions for how to prevent potential threats. The analyst will often be one member of a team responsible for ensuring that a company receives protection against external threats. Responsibilities for a cybersecurity analyst could include: 
 
Customer service associates provide online chat support or answer incoming calls from customers. They strive to deliver the best customer experiences possible. Nearly every industry employs customer service associates, but exact job titles will vary. For example, companies may refer to this position or one similar to it as a customer service representative, customer experience associate or customer support specialist. 
Custodians are responsible for the cleanliness and professional appearance of a building. They sometimes use specialized cleaning equipment and maintain a thorough knowledge of cleaning supplies and tools. A custodian’s job responsibilities include: 
 
A crime scene investigator is a law enforcement team member who manages the physical evidence found at the location of a crime. When a crime occurs, the investigator must travel to the scene to identify, collect, package and preserve evidence, which is then passed on to the forensic team to be tested and examined. Some crime scene investigators work in forensic labs to perform the testing processes, although most perform the majority of their work at crime scenes. Duties of a crime scene investigator include: 
A crew member works in a restaurant, completing food preparation, customer service and sanitization tasks. The crew member may work in the kitchen, following recipe and food preparation instructions or could work at the counter, taking orders, answering customer questions and operating the cash register. This position is typically the first point of contact for customers and conducts a variety of activities, including: 
A credit analyst is responsible for gathering and analyzing financial data to assess a new or existing loan applicant’s creditworthiness. After evaluating the data, the credit analyst determines the likely risk and recommends a course of action for the customer. These recommended actions can include approval or denial of a new credit account, interest rate or extension of an existing credit line. They often work on the computer and use software programs to help analyze and calculate the data. 
A crane operator uses advanced construction machinery to move heavy equipment and materials from one place to another. Businesses rely on crane operators to transport materials that are too heavy to move easily and to move materials to very high or very low locations. They often work closely with colleagues on the ground, who direct their movements using radio voice commands or hand signals. Crane operators may use a variety of different cranes, including tower cranes, mobile cranes and boom trucks, to perform their duties. Crane operators are responsible for all aspects of crane operation, including their safety. While duties can vary depending on their employer and industry, crane operators perform the following tasks: 
 
Cost accountants are financial specialists who analyze the costs of products that are manufactured or sold by a company. They examine the associated expenses in the supply chain and perform profitability analyses. Cost accountants help organizations identify the products, services, processes or even departments that are the most or least profitable. Some of their specific responsibilities include: 
A cosmetologist is a state-licensed beautician who is qualified to provide a wide variety of beauty services to their clients. Cosmetologists provide these services on an appointment basis, though some offer walk-in services. The typical responsibilities of a cosmetologist include: 
A coroner examines the dead bodies that enter a morgue and investigates their cause of death. Coroners investigate most deaths, especially any that take place outside of a medical facility. If a death seems suspicious for any reason, a coroner may open an official investigation of the cause of death and the events that led to the person’s death. Local communities, usually counties, have different laws that determine what the coroner does and how the position is filled. Some areas elect their coroners and others appoint them.  
A copywriter creates clear, captivating and persuasive content aimed at encouraging people to take action, usually to buy a product or subscribe to a service. They find creative ways to convert their clients’ abstract ideas into compelling content suitable for advertisement. Copywriters can produce content for magazines, websites, blogs, TV programs or other media outlets.  
A coordinator handles the logistics of events, administration, scheduling and business operations. They work in a wide variety of industries primarily focusing on bringing together people, products, clients and resources for the company. Some additional responsibilities for coordinators may include: 
 
A controller is a role responsible for managing and maintaining a business’s financial health. Some of the duties controllers typically have are: 
Consultants are independent workers who use their expertise to help clients solve problems. Businesses often hire consultants to save on the cost of recruiting and training a full-time employee. Consultants have expertise in a particular field and can bring a fresh perspective to a company. Examples of consultant job duties and responsibilities include: 
A construction worker is a manual labor professional responsible for preparing equipment, operating machinery and taking apart and building structures. Construction workers follow their clients’ instructions by using blueprints that determine the type of structure, necessary rooms and spaces, proper measurements and other construction elements. 
Construction superintendents are responsible for supervising the building of homes, commercial buildings, schools, hospitals, roads and bridges. They are in charge of daily scheduling, maintaining the safety and compliance of a construction site and supervising all activities. While their responsibilities may vary according to the project, some of their primary duties include: 
A construction engineer is a civil engineer who oversees the design and implementation of large building projects. They also assist in maintaining infrastructure systems, such as roads, dams, water supply systems and buildings. They work with a team of fellow engineers and construction crews to organize and complete projects. Other responsibilities could include:  
A concierge assists hotel guests to ensure an enjoyable stay by assisting them with booking dining and entertainment reservations and arranging shuttle or taxi services. A concierge will also offer recommendations on things to do in the area, places to eat, and other suggestions as requested. Other responsibilities include: 
Computer technicians provide computer and network support within businesses, government offices and nonprofit organizations. They may also work for third-party computer support businesses. Computer technicians are responsible for installing, maintaining and troubleshooting hardware and software as well as answering computer-related questions from employees and customers. Some of their specific responsibilities include: 
Computer programmers write the code that powers software applications. They use a variety of computer languages to develop, test and fix programs. Some specialize in certain types of applications, such as mobile programs or software as a service. Computer programmers are responsible for the following tasks: 
Computer engineers design, test, implement and maintain computer software and hardware systems. They ensure that both the physical hardware components and software programming components work together smoothly for their clients. Some computer engineers specialize in fields like robotics, virtual reality, artificial intelligence, mobile apps and operating systems. Computer engineer duties include: 
Collections specialists are responsible for resolving overdue bills and collecting payments from the individuals or businesses responsible for the debt. They must locate those responsible for unpaid bills and set up acceptable terms of repayment to protect the financial assets of their employer. Common responsibilities for a collections specialist include: 
 
A CNC operator produces machined parts by programming, setting up and operating a computer numerical control (CNC) machine. Maintaining equipment, adhering to quality and safety standards and keeping detailed part records are some of the core responsibilities of a CNC operator. Other duties include: 
 
Clinical social workers are professionals licensed to diagnose and treat people with behavioral, mental and emotional disorders. They work with clients to change damaging behaviors or manage challenges in their lives. Conditions clinical social workers might treat include anxiety, depression, eating disorders, addiction and more. Some specialize in certain areas, such as criminal justice or child welfare. Others treat specific populations, such as military personnel, students, children, elderly or families. 
Clinical psychologists diagnose and treat mental, behavioral and emotional disorders. They might work directly with patients experiencing conditions ranging from personal issues to severe and chronic disorders such as schizophrenia. They might also do research studies on behavior and the brain. Some clinical psychologists specialize in a certain population of patients, such as children or the elderly, or specific areas such as behavioral and cognitive psychology. Responsibilities of clinical psychologists can include: 
Clerks are professionals that execute a variety of administrative duties in an office environment. These individuals are integral to an organization, as they take care of all the day-to-day tasks that keep an office running. Clerks can also function as the public face of a company since they answer and return phone calls and manage incoming and outgoing emails.  
Civil engineers supervise and design major public construction projects. They also ensure project feasibility by evaluating their budget demands and design practicality. Other tasks a civil engineer may perform include: 
A chiropractor is a medical practitioner who specializes in treating pain, discomfort or injury in the bones, tendons, ligaments, nerves and muscles of the human body. Their responsibilities often include: 
Childcare providers provide care and education for babies and young children. As daycare providers and nannies, these professionals teach children, supervise their play and prepare them to succeed in school. They handle the following tasks: 
Chemical engineers use math and science to address problems involving chemicals, food, fuel and other products. They develop manufacturing equipment, materials and processes and oversee production methods. Chemical engineers perform the following tasks: 
A chef is responsible for preparing and cooking food and provides leadership for the kitchen staff. Chefs will maintain relationships with vendors and might be in charge of ordering the restaurant’s weekly food supply. They might create new menu items and work with the general manager to set business goals. 
Charge nurses manage a ward in a hospital or other healthcare facility. They are experienced nurses who delegate tasks to other staff in their unit. Charge nurses may do a combination of the following tasks: 
A certified management accountant is a professional who has been certified by the Institute of Management Accountants (IMA). Certified management accountants work in the financial accounting and strategic management fields. CMAs analyze the finances of a company or organization in order to provide insight on how to improve productivity. CMAs can take on a number of responsibilities in a company including budgeting, risk analysis, corporate accounting and financial strategizing. Other duties that a CMA may perform include: 
A caterer prepares, delivers and serves meals to diners at a special event like a wedding, anniversary party or corporate meeting. They start by meeting with a client to determine the scheduling, menu and pricing, and they then develop an estimate followed by a contract for the event. Caterers typically cook off-site and transport food, serving pieces and tableware to the event. A catering staff includes cooks, delivery people, estimators, servers and clean-up personnel. Often caterers will take on more than one role planning for and carrying out events. 
A cashier is a customer service professional responsible for the daily operations of a retail or department store. Some of the duties cashiers typically have are: 
A caseworker meets regularly with clients in at-risk populations to provide counseling and assistance. Caseworkers outline requirements and goals they set for their clients and check on them regularly to make sure they’re managing their circumstances properly. Caseworkers perform many critical tasks to help these individuals improve their lives, including:  
A carpenter is responsible for building, installing and repairing structures and frameworks for buildings. They work with clients to create drafts for their review and prepare drawings of their intended plans before beginning work. Carpenters may work on a variety of projects, including counters, showers, tubs, vanities, molding and cabinets. They must follow all code requirements for any remodeling projects they work on. 
A caregiver assists sick, elderly or disabled persons with everyday activities. A caregiver’s purpose is to make day-to-day life easier, safer and more comfortable, performing tasks such as: 
A cardiologist is a doctor who specializes in finding, treating and preventing diseases of the cardiovascular system, which includes the heart, blood vessels and other heart-related conditions. The most common conditions that cardiologists diagnose and treat are congenital heart defects, heart attacks, coronary artery disease, heart failure and heart rhythm disturbances. A cardiologist’s typical tasks include: 
A cardiac sonographer is a medical professional who performs medical imaging tests to examine patients’ hearts and vascular systems. Cardiac sonographers collect information about heart function, appearance and surrounding blood flow for cardiologists, ensuring they can provide the best care for patients with heart and blood vessel illnesses and disorders. A cardiac sonographer’s duties also typically include: 
A car salesperson helps customers find the right car, explains the benefits and drawbacks of different models and begins the payment process. A car salesperson builds a relationship with their customers and partners with the marketing team to engage new clients. A car salesperson promotes the sale of their dealership’s vehicles by: 
A call center representative answers incoming customer calls and provides support or redirects the call as needed. As the first point of contact for the customer, call center representatives set the standard of care that the customer expects from the company by: 
A buyer is a finance and business professional who investigates, evaluates and purchases products for companies to sell or use in their own operations. Also known as purchasing agents, buyers must work within a budget and often have to negotiate competitive pricing for the items they want to purchase. Here are some additional responsibilities of a buyer: 
 
A business systems analyst assesses a company’s growth plans and finds ways to strengthen and expand them while focusing on improving efficiency in every department. They are also responsible for increasing a company’s profits by finding ways to improve their income and decrease expenses. Business systems analysts must know how to analyze current data to create new suggestions and budgets for the company. 
A business intelligence analyst’s main role is to analyze data with the purpose of identifying areas where an organization can improve. They also gather and analyze data with the purpose of providing solutions to potential organizational obstacles. Other tasks may include: 
A business consultant is involved in the planning, implementation and education of businesses. They work directly with business owners on developing a business plan, identifying marketing needs and developing the necessary skills for business ownership. Additional responsibilities include: 
A business analyst identifies the needs of a business and then connects them with information technology (IT) resources to increase sales, strengthen processes and improve efficiency. Business analysts act as mediators and facilitators for all business systems, including the following responsibilities:  
 
A brand ambassador is a promotional professional hired by a company to encourage sales, increase brand awareness and represent the company’s brand at promotional events. Brand ambassadors build business-to-customer and business-to-business relationships through pop-up events, trade shows, in-store demos and product samplings. They positively represent the company and are meant to embody the brand in appearance, personality and demeanor. 
A border patrol agent is responsible for maintaining the safety and security of the country’s national boundaries. These professionals enforce federal laws when people or goods travel into the U.S. They work along the borders of Canada and Mexico as well as in the coastal waters of Florida and Puerto Rico to control the flow of legitimate trade.  
A bookkeeper is a finance professional whose primary responsibilities in an organization revolve around maintaining the company’s financial records. A bookkeeper will commonly be in charge of recording both expenditures and income, including organizing and recording all receipts, bills invoices and other financial transactions. In modern workforces, it is standard for the bookkeeper to use computing software to create digital financial records. Other duties for a bookkeeper may include: 
 
Biostatisticians are specialists that collect and analyze data from living organisms. They work mainly with data gathered via medical research, which they use to formulate conclusions and make predictions. Biostatisticians work in a specialized field of statistics known as biostatistics. This field involves the study of data related to living things. Biostatisticians routinely perform the following tasks: 
A billing specialist is an administrator who manages billing processes, most often for an insurance office or medical facility. A billing specialist’s duties include managing medical billing for patients, updating patient information, generating invoices and processing payments. Other duties include the following:  
The billing clerk is a financial professional who generates invoices and credit memos for distribution to customers. Billing clerks are also called posting clerks, financial clerks or invoicing clerks. Many accountants begin their careers as billing clerks. Industries that employ billing clerks include healthcare, retailers, casinos, restaurants, maintenance and manufacturing and transport services employ billing clerks. The requirements of your job will differ depending on the sector of your employer.  
