An office coordinator is a business professional responsible for keeping an office operating smoothly. Office coordinators work in almost every industry, including health care, social services, education and technical services. They support all office staff, from executives to entry-level employees. An office coordinator’s duties depend on their workplace, but they typically include: 
An office clerk is an administrative professional who performs a variety of general office tasks such as typing documents, answering phone calls, filing records and entering data. Specific duties vary depending on the employer’s needs. For example, an office clerk working for a school may process student applications and answer admissions questions, while an office clerk working at a hospital may process payment information and maintain the filing system of patient records.  
An office assistant is a business professional who supports the day-to-day operations of an office and its staff members. This role involves greeting guests, maintaining a clean and inviting office space and executing related tasks under the direction of the office manager, executive secretary or senior office leaders. Additional responsibilities include: 
An office administrator is an administrative professional who performs a variety of clerical tasks to help an organization’s operations run efficiently. Depending on their industry, office administrators’ primary duties may include providing administrative support to staff, organizing files, arranging travel for executives, performing bookkeeping and processing payroll. Additional responsibilities may include: 
Occupational therapy assistants, or OTAs, are healthcare professionals who assist occupational therapists with the rehabilitation and care of patients. These patients can include adults and children with physical issues and injuries and also those with mental and emotional conditions. An occupational therapy assistant aims to help their clients to carry out their daily lives comfortably and capably. Occupational therapies vary from teaching someone with a broken leg on how to get around the house to helping someone to leave their house and go shopping. 
An occupational therapist assistant (OTA) supports the occupational therapist in helping patients recover, develop, improve and maintain the skills they need to continue functioning in daily life through the use of therapeutic techniques. They may work with adults or children who have different needs. Occupational therapist assistant’s common responsibilities include: 
Occupational therapists assist disabled, chronically ill and seriously injured patients with everyday activities. They help patients relearn and increase the skills they need to live and work independently. Occupational therapists typically perform the following tasks: 
Obstetricians are medical practitioners and trained surgeons who offer specialized care to women during pregnancy, delivery and after delivery. They seek to diagnose, prevent or treat any conditions that arise during the gestation period. Most of these professionals are also specialists in female reproductive health and gynecology, often becoming obstetrician-gynecologists. They perform the following duties:  
An OB-GYN is a doctor who specializes in obstetrics (pregnancy) and gynecology (female reproductive health). Responsibilities for OB-GYNs can vary, but typically include: 
 
A nursing assistant is a healthcare professional who helps patients with their basic daily care. They work closely with their patients under the supervision of a licensed nurse. A nursing assistant plays a vital role in ensuring that patients are comfortable and have their personal needs met. Another critical aspect of the role is to keep the managing nurse up to date with information regarding the patients’ conditions and mental states.  
A nurse practitioner is an Advanced Practice Registered Nurse (APRN) who is qualified to examine patients, diagnose illnesses, prescribe medication and provide treatment. Nurse practitioners typically specialize in a specific area of medicine and their duties can vary depending on their area of specialization. Some of their general responsibilities include: 
Nurse informaticists use their knowledge of healthcare, computer and information sciences to maintain and develop medical data and systems to support the practice of nursing and improve patient care. They review large amounts of patient data in order to develop new healthcare technology systems. This career combines both nursing and information technology in order to apply new software and programs to the medical field.  
A nurse educator is a healthcare professional who teaches nursing students in an educational setting. They often work in the classroom, creating lesson plans and educating nursing students on the theories and strategies of nursing. Some nurse educators may also participate in the continuing education of current nursing professionals. A nurse educator may have the following responsibilities: 
A certified registered nurse anesthetist (CRNA) is a type of advanced practice registered nurse (APRN), but one who specializes in administering anesthesia. Nurse anesthetists help surgeons, anesthesiologists, dentists and other types of medical professionals ensure that anesthesia is safely administered to patients. In some cases, a nurse anesthetist is the only anesthetist on call at a given medical practice or healthcare facility. Some CRNAs are independent healthcare professionals, which means that they work without being supervised by a physician. 
Nurses are highly-trained healthcare professionals who provide care, support, treatment and advocacy for patients. They play a vital role in hospitals, clinics, nursing homes and in the community. Nurses can work with many different patients, from newborn babies to the elderly. They treat sick people and work with healthy individuals to assist with education and promotion of healthy lifestyles. Depending on the specialty of the nurse and the organization they work for, there is a wide range of responsibilities they may have and duties they could perform, including: 
 A nuclear engineer uses math and analytical skills to develop instruments and processes related to radiation and nuclear energy. Some nuclear engineers work in spacecraft and have developed special nuclear tools and power sources for spaceships and other related equipment. Other nuclear engineers may develop systems for medical use, like proton therapy for cancer patients. Nuclear engineers are at the cutting edge in finding safe ways to use nuclear energy to solve some of the world’s problems. Specific tasks you may encounter as a nuclear engineer include:  
A night auditor is the first point of contact for late-night hotel guests and manages many aspects of their visit. A night auditor acts as a front desk agent, with the added responsibility of balancing reports from the previous day’s shifts. Other responsibilities include: 
A news anchor reports local, national or international news and events to the public on television or radio. Some specialize in a certain topic, such as sports or politics, while others cover a variety of events and happenings. News anchors might broadcast live from a television studio or travel to the site of an event to gather and share information on camera. Other news anchor job responsibilities might include: 
A neurosurgeon performs treat conditions that affect patients’ brains and spinal cords. They use a variety of processes and tests to diagnose illnesses and form plans to remove the cause and prevent recurrences. In most cases, they perform surgeries to heal patients. Typical duties for a neurosurgeon could include: 
A neuropsychologist works with other medical professionals to identify and treat the psychological effects of various neurological disorders. Neuropsychologists are also involved in research to better understand the psychological and behavioral indications of neurology on the body. A neuropsychologist may have the following responsibilities: 
A neurologist is a specialist physician who treats conditions that relate to the nervous system, including the brain, spinal cord, and nerves. Neurologists often treat conditions like epilepsy, multiple sclerosis and strokes. On a day-to-day basis, neurologists have many tasks that enable them to diagnose cases and work with patients to improve their condition, such as: 
A network technician is responsible for implementing, maintaining, troubleshooting and repairing computer and network systems. Network technicians set up Internet connections, establish different types of networks and connect them. Some of the specific responsibilities for this role include: 
Network engineers design, build, implement and maintain the computer networks businesses and organizations use. These networks may include the phone system, intranet, extranet and more. Network engineers are responsible for the maintenance of these essential systems which may include assessing performance, completing regular maintenance, diagnosing issues and repairing problems. A network engineer’s job responsibilities include: 
A network administrator is responsible for maintaining local area networks (LAN), wide area networks (WAN), internet, intranet and network segment systems. They are responsible for installing network hardware, training users, and maintaining the network’s overall stability and security. Some of their specific duties include: 
A neonatologist is a highly trained pediatric doctor to infants who need medical attention because of premature birth, birth defects or any illness which puts them in the Neonatal Intensive Care Unit (NICU) of a hospital. Neonatologists study special development, illnesses and other factors that affect the development of a newborn. Sometimes, they may help with the prenatal care of women whose pregnancies have been diagnosed with fetal abnormalities. Other responsibilities of a neonatologist include: 
A neonatal nurse is a healthcare professional who focuses on the care of newborn infants during the first four weeks of their lives. These professionals may care for healthy infants or provide more focused care for newborns who are ill or premature. Neonatal nurses typically serve as the bridge between the specialist and parent when working with the newborn. Some of a neonatal nurse’s additional responsibilities may include: 
 
Mortgage brokers act as an intermediary between a lending financial institution and a prospective homeowner. They present mortgage loan options to a consumer from multiple lenders for comparison and evaluate financial and employment information from buyers. Once a lender offers a mortgage to a buyer, they complete the loan paperwork. Brokers can work in residential or commercial real estate.  
A millwright assembles, installs, dismantles and moves machinery of nearly all types, ranging from conveyor systems to turbine generators. These complex tasks can take days or weeks to complete, as a millwright typically works with very advanced machines. Millwrights are found in a wide variety of industries, including power, aggregate and mining, construction, recycling, manufacturing, foundry and food processing plants. Essential tasks performed by a millwright include: 
A midwife is a healthcare professional who assists female patients before, during and after natural labor. They specialize in helping women give birth without medical interventions, such as inductions and pain treatments. Some of the most common responsibilities include: 
A merchandiser is a retail inventory professional. Some of the duties merchandisers typically have are: 
Mental health counselors help people with mental health conditions such as depression, stress, trauma and addiction. They typically work with clients over time with the goal of seeing them achieve psychological and emotional well-being. Their work often includes: 
Medical transcribers transform doctors’ dictations into written documents that convey information about patients’ health. They are responsible for updating patients’ electronic health records accurately and confidentially. Medical transcribers perform the following tasks: 
A medical technologist, also known as a medical laboratory scientist, performs testing in a laboratory setting, logging results while following established laboratory protocol. While they prepare specimens for examination, the medical technologist may use automated technology as well as specialized instrumentation to complete the test and interpret the results. They also diagnose, troubleshoot and repair issues with laboratory equipment.  
Medical technicians assist with medical diagnoses by performing tests for physicians and hospitals in a laboratory setting. They may test blood, bodily fluids and tissue samples for the presence of bacteria, viruses or diseases and provide the results to doctors. They also may specialize in working in a hospital department where they assist physicians and patients in surgery or other medical procedures. 
A medical secretary provides important clerical work for a hospital, doctor’s office or other medical institution. They serve as a point of contact between the office and outside parties and oversee organization within the facility. 
Medical scribes accompany physicians during examinations and chart the physician-patient encounters in real-time on the computer. It’s a position often held by medical school applicants who are taking college classes, as the position requires in-depth knowledge and understanding of medical terminology. A medical scribe helps to speed up examinations by taking detailed notes while allowing the physician to focus solely on patient care. 
Medical records clerks manage patient files. They collect and file information, usually in health care facilities such as hospitals or clinics. A medical records clerk may do a combination of the following tasks: 
Medical receptionists work at the front desks at hospitals, doctor’s offices and other medical facilities. They work at reception desks, often answering phones, greeting visitors and doing clerical work. Additionally, a medical receptionist might also have the following duties: 
The medical office assistant greets patients when they enter the clinic and takes their information, including contact details, medical history and insurance information.  
A medical examiner evaluates the bodies of deceased people to determine the probable cause of death, their identity and the time of death. They perform autopsies in cases where deaths are unexpected or criminal activity is suspected. They may also share their findings and judgments about the probable cause of death during court cases. The typical duties of medical examiners include: 
Medical coders are responsible for completing, reviewing and processing medical claims from hospitals and doctors’ offices to help them get reimbursed by insurances companies for the services provided to patients. They use specialized medical classification software to assign diagnosis and procedure codes for insurance billing. They also review claims data for accuracy and completeness, ensuring that the assigned codes meet required insurance and legal rules and that the necessary signatures and authorizations are in place before submission. Other responsibilities include: 
Medical billers are health information technicians who manage payments on patient balances and oversee insurance claims for a healthcare provider. These professionals can work for a variety of healthcare practices, including primary care facilities, clinics, hospitals and specialists. Some common responsibilities include: 
A medical assistant supports allied health professionals in a clinical environment. They’re responsible for performing various clinical and administrative duties to increase the quality of care for the patient. Their job is critical to the success of doctors and nurses within a specific medical practice to ensure it runs efficiently.  
A mechanical engineer’s main role is to design, build and test thermal and mechanical devices. Their services are very diverse and are typically related to all parts of the planning and execution processes. Other tasks a mechanical engineer may perform include: 
A mechanic uses advanced technical and mechanical skills to troubleshoot, diagnose and fix vehicle problems. Mechanics may also complete preventative maintenance to keep a vehicle running efficiently. A mechanic may have the following responsibilities: 
A material handler—also called package handler, warehouse associate or hand laborer—manually moves products, merchandise, stock or other materials. Material handlers work in throughout many supply chains, including manufacturing and production, shipping and storage and customer receiving. The work may involve feeding or removing material to and from machines, cleaning vehicles and packing materials for moving. 
A massage therapist is a professional who manually applies pressure throughout the body to treat pain, increase relaxation, reduce stress, rehabilitate injuries and aid in the general wellness of their clients. A key element of their job involves assessing each client individually, creating personal therapy plans and referring clients to other specialists if necessary. Other duties that a massage therapist performs include: 
A marketing specialist is part of the marketing team and assists in developing and executing campaigns to gain prospective customers and increase sales. A marketing specialist is also responsible for the following:  
A marketing intern assists a company in its marketing and advertising efforts. The marketing intern may be involved in many tasks, including identifying marketing needs, designing marketing materials and working with team members to evaluate current marketing efforts. Marketing interns use their educational background in marketing to assist the company while also learning on-the-job experience. Marketing interns may be involved in the following tasks: 
A marketing coordinator assists the marketing department of a company in coordinating all of its marketing efforts. The marketing coordinator may assist the director or vice president of marketing, completing tasks that help the department reach its marketing goals. A marketing coordinator may have the following responsibilities: 
Marketing assistants are responsible for researching, compiling and reporting on buying trends and statistics, copywriting for marketing materials and other support, such as: 
Manufacturing engineers evaluate the process of manufacturing in a company, identify potential improvements, and create and implement solutions. They can work in many different types of facilities in any industry that manufactures products. Manufacturing engineer duties include: 
A makeup artist uses cosmetic products and techniques to enhance or alter a person’s appearance. Some of the products makeup artists use include eyeshadow, eyeliner, concealer, foundation, lipstick and mascara, as well as the application tools to apply products to the face and body. Makeup artists can work in department stores, salons, independently or in other industries. The use of makeup usually intends to highlight the beauty in a person’s appearance, so the role of a makeup artist is to make each client look and feel their best. Makeup artists also work in the entertainment industry and can assist with creating and applying masks or other ways of changing a person’s appearance for a theatric role. Duties of a makeup artist include: 
 
Machine operators are laborers who use heavy machinery to complete manufacturing, disassembling and other tasks. These professionals—also referred to as machinists—often specialize in one specific machine or type of machinery, and jobs are often listed based on the types of machinery and equipment located on the job site. Some positions may include: 
While the responsibilities may vary depending on the industry, a logistics specialist coordinator is ultimately responsible for overseeing the life cycle of products, including preparation, shipping and receiving. They work in fast-paced environments that are deadline-driven and usually manage multiple transportation projects at a time. They are responsible for planning and overseeing the movement of a product from the time it is created to the time it reaches consumers and may be responsible for investigating customer problems and providing strategic solutions. Some of their specific responsibilities include: 
A logistics coordinator plans and manages people, projects and processes, with specific duties varying according to the industry in which they work. They may work in healthcare, education or manufacturing. Regardless of the industry, a logistics coordinator is responsible for analyzing and coordinating an organization’s supply chain in order to move products from the supplier to the consumer as quickly and efficiently as possible. Some of the specific responsibilities for this role include: 
A lobbyist is an activist who champions for a specific line of thought on a particular issue. Lobbyists aim to persuade or influence policies, actions or political decisions of elected officials and other government—federal, state or local—agencies. Usually, they exert their influence on behalf of various interest groups including community organizations, industry associations, labor unions, non-governmental organizations, veteran organizations, foreign governments, corporations and environmental groups among others. 
When someone applies for a loan application, their information and application get sent to a loan processor. The loan processor is responsible for processing mortgage applications and getting them prepared for the mortgage underwriter. The loan processor gathers all the necessary documentation required to receive the loan, including employment verification, bank statements, monthly bills and other income information, if applicable. They then organize the information in the customer’s file so the underwriter can locate the information quickly. Other duties include: 
Loan officers help people and businesses secure financing. Loan officers often help people get money for homes, cars, college tuition and even start-up businesses. They determine the amount of money the individual should receive and communicate any requirements and stipulations that accompany the loan. Some loan officers specialize in mortgages or commercial loans. Some of their specific responsibilities include: 
A line cook is responsible for food preparation, often in the hospitality industry. They might work in a restaurant, hotel or corporate cafeteria. The “line” of a kitchen is the group of cooks who combine efforts to carry out the recipes and menu items designed by the executive or head chef. 
Lifeguards monitor pools, beaches, water parks and other aquatic areas in order to maintain safety at all times. They are trained in water safety and are called on to rescue swimmers who are hurt, sick or distressed. A lifeguard might also have the following duties: 
A life coach is a personal development professional who assists clients with introspection, setting goals and improving aspects of their lives. Some life coaches specialize in career and professional development while others provide assistance with relationships, spirituality and emotional wellness among other elements. The responsibilities of a life coach often include: 
 
 
A legal secretary, also called legal assistant, works in law offices or organizations to provide administrative, research and organizational support to lawyers and paralegals. While legal secretaries perform some standard secretarial duties, they spend most of their time performing tasks that are specific to the law field. Other responsibilities of legal secretaries include the following: 
A legal nurse consultant acts as an expert witness on legal cases that involve medical issues. Legal nurse consultants combine their legal knowledge with their clinical experience and medical education to help legal cases progress. The responsibilities of a legal nurse consultant include: 
Legal assistants help lawyers by organizing legal documents, gathering information about cases and assisting during trials and hearings. Their research and organization of the facts and paperwork involved in cases help lawyers prepare for trial. Legal assistants can work in various areas, including corporate law, litigation, criminal law, immigration and more. While their duties vary depending on the size and type of the firm, legal assistant responsibilities might include: 
 
 
Lead teachers typically work alongside a team of other teachers and are expected to align curriculum across a grade level to ensure all students are receiving a similar education. As the lead teacher of the team, other teachers will look to them as a mentor and may come to them with questions and concerns about their students, lesson plans and other issues. 
 
A law clerk, sometimes called a judicial clerk or a judicial law clerk, is a legal professional who helps a judge or lawyer make legal decisions. A law clerk’s duties depend on whether they are a trial law clerk working in courts, an appellate law clerk working on civil and criminal appeals cases, or a law clerk working at a legal firm. Many law clerks share the following responsibilities: 
