Web developers are responsible for writing code to create a website, both at the front end and the back end. The front end includes the website users see and the back end is the side that delivers information to the front end. In smaller firms, a web developer is also responsible for some level of web design. Web developer duties can include: 
Web designers develop functional and appealing websites for individuals, businesses and government agencies. They use knowledge of computer programming and graphic design to create websites that meet client needs. 
 
A veterinary technician provides technical assistance to a veterinarian similar to the assistance a nurse provides to a doctor. They are typically able to perform any task given to them by the veterinarian except for giving diagnoses, prescribing medicines and performing surgery. These tasks could include: 
Veterinary assistants are part of a team of professionals who care for animals. Their responsibilities often include a mix of clerical and office duties with hands-on animal care. They communicate with pet owners and assist veterinarians by preparing their tools and environment so they can perform their work efficiently. Additional responsibilities of a veterinary assistant may include: 
A veterinarian is a medical practitioner who specializes in the treatment of animals. This includes diagnosing illnesses, treating and preventing diseases and tending to injuries. They administer vaccinations and medications and perform surgeries. They also perform routine wellness visits for animals and offer guidance to pet owners on how to provide the best care for their animals. Their responsibilities also include: 
A vascular surgeon is a medical professional who specializes in conditions relating to the arteries and veins. Common responsibilities for this position include: 
Urban planners create and implement land development strategies while accomplishing goals like cultivating communities and encouraging growth. They develop plans for neighborhoods, towns, cities and counties. Some specialize in areas like public transportation or historic preservation. Urban planners also do the following tasks: 
An underwriter examines loan, mortgage, insurance or securities applications to determine risk. They base their assessment on a careful analysis of the applicant’s data. An underwriter’s job responsibilities include: 
An ultrasound technician is a healthcare professional who works with patients and doctors to help diagnose illnesses of the internal organs. Also known as diagnostic medical technicians or sonographers, these healthcare professionals use ultrasound equipment that emits sound waves to produce digital images of the body. It is possible to specialize in cardiac, breast, vascular, obstetric or gynecologic ultrasonography.  
A treasurer is a finance professional who directly oversees the short- and long-term budgetary goals of an organization or business. The treasurer’s main responsibility is to make sure that the organization or business is in good financial standing, which requires them to produce detailed financial statements and coordinate investment decisions. Treasurers also work with other corporate executives to create and meet budgetary benchmarks as directed by the chief executive officer.  
Travel agents arrange trips and excursions for individuals and groups. They sell transportation, accommodations, tours and attraction admission to leisure and corporate clients. Travel agents are responsible for the following tasks: 
A training coordinator develops and conducts training programs for employees or volunteers in organizations. This person typically works within a human resources department and may work independently or as part of a team, depending on the size of the business. It is their responsibility to make sure all employees are properly trained in line with the organization’s goals. Training coordinators’ duties include: 
A toxicologist researches the effects chemicals may have on humans or animals. They may test water supplies, food and tissue samples for the presence of chemicals. A toxicologist could make suggestions on the safety of certain products, such as cosmetics or cleaning supplies.  
Telemarketers, also known as sales representatives, sell products or services over the telephone or through web conferencing. They usually work in call centers or at home for third-party call center companies. 
A technical writer creates documents simplified technical documents that are easy to understand. They write instruction manuals, guides, journal articles or other kinds of supporting documentation. Technical writers often work for businesses organizing, creating and distributing technical documents. 
Technical support specialists work with end-users to provide technical support and assistance for technical, software and hardware problems. Some of the more common problems they troubleshoot include connection problems, slow performance, inabilities to access data and inefficient programs. Specific responsibilities for this role include: 
A teaching assistant is an education professional who is responsible for helping teachers carry out their lesson plans during classes. They work with teachers to assist with any duties the teachers may need help with, such as working individually with students to improve their performance or answering questions about an assignment. Teacher assistants may also work with their supervising teacher to discuss the progress of students and make suggestions on how to address them. They might work in a separate classroom to help students with disabilities while the teacher instructs the rest of the class in a different classroom. 
A teacher assistant works closely with a lead teacher in a classroom to understand the needs of students and develop lesson plans based on those needs and on state requirements. The teacher assistant collaborates regularly with the teacher, helps out as needed on a daily basis and runs the class when the teacher is absent. They may also work in a classroom in a school district or in a charter or private early childhood learning facility. A teacher assistant may engage in the following: 
A teacher is a professional educator who prepares students to continue their studies to enter the job market by providing knowledge. Teachers can also educate their students in soft skills, such as listening and time management, and hard skills, such as technical knowledge. A teaching position can involve the following duties: 
Tax preparers are finance professionals who prepare and file individuals’ and businesses’ tax returns. They meet with clients to gather their tax information, such as marital status, number of children and other dependents, salary and other taxable income among other information required by the Internal Revenue Service (IRS). Then they fill out, sign and file all the appropriate forms according to federal and state tax codes. Since tax returns can range from simple to extremely complex, many people and companies hire tax preparers to do their taxes correctly and make sure they get the greatest tax refund for their situation. 
Systems engineers oversee all aspects of a project or system in a variety of fields, such as software, transportation, product development and manufacturing. Their job is to develop a system that creates a product from the beginning to the end. Systems engineers work in multiple industries, and their duties vary accordingly. Here are some examples of what a systems engineer might do: 
Systems analysts are responsible for ensuring an organization’s system is meeting the needs of the business. They examine the needs of an organization and suggest or design new programs to meet those needs and help the business operate more efficiently. Some of their specific responsibilities include: 
A system administrator is responsible for the configuration, upkeep and reliable operation of a company’s network and computer systems.  In addition to identifying and fixing any network issues, they also make updates to the equipment and software to ensure they are current. They may work in office settings for small or large companies or in government organizations. Some of the specific responsibilities that system administrators may have include: 
A surveyor measures and maps boundary lines for land, water and air spaces. They assess these spaces in person and compare their measurements to existing records to ensure accuracy. The work of surveyors is necessary for the construction and real estate industries. Surveyors determine where buildings, roads, bridges and other new construction projects should be located and what foundations are required. Land must be surveyed for legal purposes when vacant blocks or property are purchased or sold. During a typical day, surveyors may complete the following tasks: 
A surgical technician is a healthcare professional who assists the surgeon and the medical team in the operating room. They organize and prepare instruments to ensure that the surgeon has everything they need for surgery. A surgical technician may have the following responsibilities: 
A surgical assistant is a medical professional who provides help during surgical and medical procedures. In addition to primary duties assisting surgeons and nurses during the procedure, the surgical assistant also provides additional support before and after procedures. The surgical assistant plays a crucial role in keeping an operating room functioning at its best, with responsibilities that include: 
A surgeon is a medical professional who performs operations on patients. They typically specialize in one area, for example, pediatrics, oral, neurological or reconstructive. The operations they perform can serve a variety of purposes, including repairing an injury, preventive measures like removing a body part to stop cancer or improving a bodily process like digestion. Surgeons also complete the following tasks:  
A structural engineer is responsible for designing and constructing physical structures to withstand external pressures. They are concerned with ensuring the integrity of each element of a structure, such as beams, foundations, columns and floors. Their job involves securing the safety of several different types of structures such as buildings, bridges, tunnels, towers and dams. They also improve the integrity of existing structures. Structural engineering is a specialty of civil engineering, and people who want to practice structural engineering have to take certification exams. A structural engineering certification licenses them to offer engineering services to the public. 
 
A store associate is a professional who interacts with a store’s clientele. These individuals welcome clients and assist them, such as explaining what products or services the company offers or answering a client’s specific questions. As store associates are the public face of a company, they need to have excellent people skills and should also be well-informed about the products they are selling.  
A stocker is responsible for inventory stocking and management in a retail or department store. Some of the duties stockers typically have typically include: 
Stockbrokers buy and trade financial securities for their clients. Some stockbrokers may also act as a financial and stock market consultant. Stockbrokers have the following responsibilities: 
Statisticians provide an in-depth analysis of data to identify trends and other useful information. Statisticians have a broad range of options for career choices, as their talents can be applied in many industrial sectors. The statistician applies mathematical theories to industrial data to reach conclusions that can then be applied by professionals in the field. A statistician’s duties may include: 
A state trooper works to promote traffic safety and enforce motor vehicle laws in a specific state. Each state has its own force of troopers, who are authorized to give tickets and arrest people who are in violation of federal or state laws. Other names for state troopers include highway patrol officers, state highway patrol officers and state patrol officers. 
Staff accountants handle basic accounting tasks like financial reporting, budget preparation and general bookkeeping for an organization. Many professionals in this position prepare tax returns and some also manage accounts payable and receivable. Staff accountants typically work under experienced professionals like controllers or certified public accountants. As a staff accountant, you can expect to fulfill the following responsibilities: 
Speech therapists assess, diagnose and treat speech, language, social communication, cognitive-communication and swallowing disorders in children and adults. Speech therapists may do a combination of the following tasks: 
Speech pathologists work with people who have communication disorders or have difficulty speaking or swallowing. They diagnose and treat speech issues caused by conditions such as stroke, hearing loss, cleft palate, developmental disorders like autism, brain trauma and nervous system disorders like Parkinson’s. Communication challenges might range from a complete inability to speak to stuttering or pitch issues. Some speech pathologists specialize in certain groups of patients, such as children or the elderly, or specific conditions. Speech pathologist responsibilities might include: 
A special education teacher works with students who have physical, emotional or learning disabilities. Special education teachers adapt lesson plans for students who have disabilities that challenge them in normal classroom environments. In addition to traditional responsibilities, a special education teacher will: 
 
A sonographer is a medical professional who operates ultrasonic imaging machines to document and diagnose patient conditions. These professionals are also referred to as “ultrasound technicians” and typically have the following responsibilities: 
Software engineers develop systems and software for businesses. These products range from business applications and games to network control systems and operating systems. A software engineer’s responsibilities may also include: 
A software developer designs software or applications that allow users to perform specific tasks, such as building a spreadsheet, watching a movie or playing a game, on computers and mobile devices. While some software developers focus on creating specific software or applications, others focus on creating large networks or systems that manage the devices or control networks. Other duties and responsibilities of a software developer include: 
A software architect is an expert-level software developer who communicates with businesses and clients to design and execute solutions with a team of software engineers. A software architect makes executive software design decisions. They often act as a designer, developer and communicator. Responsibilities include: 
Social workers help individuals and families cope with various challenges, including trauma, debilitating injuries, addiction, disabilities and terminal illness. Some of a social worker’s responsibilities include: 
A social media intern is an aspiring marketing and communications professional who is supervised by a manager to help manage and create content for an organization’s different social media. A social media intern may create content related to a company’s brand, products, events and services. The social media intern is trained to understand the company, product or brand they will work with to post relevant content. 
A shipping clerk ensures operations in a warehouse run efficiently by monitoring the outgoing shipments. Depending on the size of the company, a shipping clerk may work alone or as part of a team in a shipping department. This person might be in charge of receivables as well. Other duties of shipping clerks may include: 
A service advisor is a customer service professional who works at an automotive shop. Some of the duties service advisors typically have are: 
 
Senior accountants report costs, margins, expenditures and productivity for corporations and organizations. Senior accountants typically work alongside junior accountants who perform administrative tasks such as updating journal entries, gathering data and balance sheet population. Specific responsibilities may vary based on the industry and size of the company the senior accountant works for, but typically include:  
A security officer is responsible for making sure all visitors and employees remain safe in a particular building or area. They interact with a variety of people each shift and need to know how to perform crowd control when necessary. Other duties security officers may perform include: 
A security guard protects property from hazards and harm. They may be positioned in a specific building or area for an entire shift, and they are entrusted with keeping watch over the space. If there is a problem related to criminal activity, damaged property or other disturbances, a security guard will solve the problem and contact authorities. Additionally, a security guard may have the following duties: 
A secretary, also known as an administrative assistant, is responsible for the planning, administrative and organizational duties involved in maintaining an organization. The duties of a secretary vary by employer and industry, but they usually include answering phone calls, e-mailing correspondence, organizing meetings, taking meeting minutes and coordinating inter-office communications. In addition to basic office functions, some secretaries also perform more advanced executive functions or specialize in areas such as legal or healthcare support. 
A scrum master ensures professional teams follow processes to complete projects. Scrum is a type of project management methodology that uses Agile principles. Scrum masters use specific project management techniques that help them release a product or service in stages, so customers can offer input at every step. Since they employ group decision-making, scrum masters are often considered servant leaders. Though scrum masters can work in a variety of industries, they share common duties: 
A school social worker is a professional responsible for helping students, parents and school staff identify problems that impede learning. Their ultimate goal is to successfully address emotional, social and academic issues so that students live a healthy, safe and balanced life. When students experience a dramatic lifestyle change, their personality and schoolwork are usually affected. With the help of school social workers, students receive help such as crisis intervention, counseling and prevention programs that provide them a chance at academic success. Other duties that a school social worker performs include: 
A school nurse attends to the medical care of students in a primary or secondary school. School nurses keep records of students’ height, weight, vision and hearing exams and any ongoing medical issues or allergies students have. The responsibilities of a school nurse depend on the size of the school and its location. These responsibilities may include: 
A school counselor is an education professional who guides students in developing valuable academic and social skills necessary for their success. They can work with many school ages, from kindergarten to high school. Their main responsibility is to identify individual students’ strengths and encourage them to pursue opportunities that challenge and interest them. Some specific responsibilities include: 
A school bus driver transports students from home to school and school to home safely. They might also transport students to field trips, sporting events and off-campus activities. Other school bus driver responsibilities might include: 
A scheduler coordinates the daily schedules within a medical facility. Their primary duties typically involve managing the flow of patient care. A scheduler’s responsibilities can include: 
A sales support specialist guides customers through every step of a sale and helps solve any questions or concerns the customer might have. They help process, track and ship orders efficiently. Sales support specialists also maintain databases of sales and identify and create lists of potential customers. Other responsibilities of a sales support specialist might include: 
A sales representative uses strong customer service and communication skills to sell goods or services. They should maintain a strong understanding of their company’s products to highlight features and increase sales. Additional responsibilities for this position include: 
Sales engineers sell products or services for a company. They often specialize in selling highly technical products or services, and they spend a significant amount of time researching their products to ensure they understand them completely. Sales engineers may sell products such as computer systems, programmable automated machinery and mechanical equipment used for moving or controlling material goods. Duties and responsibilities of sales engineers may include: 
A sales coordinator is responsible for coordinating the flow of products or services to consumers. They manage the schedules and territories of the different members of the sales team, set sales goals and arrange training schedules. They may help the team members improve their productivity by arranging appointments and ensuring they have up-to-date support material. They also coordinate with other departments within an organization to ensure that sales, marketing and deliveries are handled effectively. Some of their specific responsibilities can include: 
A sales consultant uses their skills and experience to help businesses increase sales by suggesting specific improvements in the company’s processes. The consultant might work for a consulting firm or they could be self-employed and work directly with clients on a contract basis. 
Sales clerks help store customers purchase products. Their customer-focused role enhances the store environment and encourages shoppers to return. The duties of sales clerks often overlap with cashiers and shelf-stockers. Some typical duties of sales clerks include: 
A sales associate assists customers in finding the right product or service to suit their needs by explaining the benefits and uses of various items. They may also process the customer’s payment and package the goods for them to leave the store. Sales associates build a rapport with their guests to encourage repeat sales, and they assist with marketing strategies. A sales associate promotes product sales by: 
A sales assistant uses their skills to provide customer service, process payments and ensure smooth transactions in a retail setting. They must have proficient knowledge of the store’s layout and inventory in order to help locate products for customers, and they are tasked with keeping the store organized and stocked. Other duties of a sales assistant may include: 
A rheumatologist uses advanced medical knowledge to diagnose and treat musculoskeletal and autoimmune disorders. Rheumatologists assist patients by evaluating their symptoms and ordering diagnostic imaging. They might also make recommendations to improve symptoms or prevent the progression of a rheumatic disease. A rheumatologist may have the following responsibilities: 
Retail sales associates sell goods and services to customers. As retail professionals, they work in stores, where they do everything from helping customers select merchandise to processing payments. Sales associates perform the following tasks: 
Retail sales associates help customers to select and purchase products in a retail environment. They work in a variety of businesses, including fashion, sporting goods, building materials and garden equipment, music stores, book stores, automotive and electronics. They may operate the cash register, take inventory, restock shelves and clean the floor space and work areas. Some of their other duties typically include: 
A restaurant server provides for customers in various dining establishments. This role is the restaurant’s primary point of contact with patrons. Restaurant servers ensure customers are happy with their dining experience by: 
Respiratory therapists provide care for people who have trouble breathing. Their patients range from people who have chronic respiratory heart diseases like bronchitis, emphysema or asthma, patients with sleep disorders and also patients in need of emergency care after heart attacks, drowning or shock. They may also help infants who need respiratory therapy because of premature births. Some specific responsibilities for this role include: 
A resident assistant is responsible for serving the needs of patients living in long-term care and retirement facilities. They help chronically ill, disabled and less independent residents with activities of daily living such as bathing, using the toilet, eating, dressing and washing. They also help with other tasks such as physical mobility and social and recreational activities. 
A reporter uses investigative research skills to gather the details of a story or event, then delivers the facts to the public. The topics reporters could research include local and global events and may involve field investigation. Some reporters specialize in certain topics, such as weather, sports or politics. The reporter may deliver this information via newspaper, media, magazine or on a digital platform. Reporters often have the following responsibilities: 
 
