role,education_degree,salary,jobs,Summary,detail,skills,qualifications
Structural Engineer ,"Bachelor in Civil Engineering, Bachelor in Construction Engineering",83459 per year ,"17,000+",A structural engineer is responsible for designing and constructing physical structures to withstand external pressures. They are concerned with ensuring the integrity of each element of a structure such as beams foundations columns and floors. Their job involves securing the safety of several different types of structures such as buildings bridges tunnels towers and dams. They also improve the integrity of existing structures. Structural engineering is a specialty of civil engineering and people who want to practice structural engineering have to take certification exams. A structural engineering certification licenses them to offer engineering services to the public. Some of their primary duties include:,Preparing building designs and calculating the load and stress that a building can withstand. Using computer-aided software to calculate a building's reaction to weather. Obtaining the regulatory permits for construction of a building. Preparing cost estimates of structures and selecting materials for a building. Supervising building construction and advising project managers. Liaising with other professionals like architects engineers and builders to deliver a project. Managing projects and administering contracts ,AutoCAD.  Revit.  Mathcad.  FEA.  Construction Experience.  CAD.  Project Engineering.  MicroStation.  Technical Writing.  Renovation.  Bluebeam.  Project Leadership ,Professional Engineer. Fundamentals of Engineering. MCSE. LEED Certification. OSHA 10. Physician Assistant License. OSHA 30. MTA. Certified Welding Inspector. ACI Certification. Certified Benefits Professional 
School Nurse ,Bachelor of Nursing,25.82 per hour  ,"35,000+",A school nurse attends to the medical care of students in a primary or secondary school. School nurses keep records of students' height weight vision and hearing exams and any ongoing medical issues or allergies students have. The responsibilities of a school nurse depend on the size of the school and its location. These responsibilities may include: ,Assessing the general health development and growth of school children. Adhering to the state standards for school nurses. Promoting health education to students and their families. Providing first aid to injured students. Administering any prescription medications for students. Providing care and certain necessary procedures for disabled students. Providing disease prevention programs and education. Monitoring the well-being of all students especially those with chronic conditions like asthma diabetes or severe allergies. Advocating for the well-being of children and identifying abusive situations that require the intervention of social services ,Pediatrics Experience.  Tube Feeding.  Medication Administration.  Nursing.  Catheterization.  Public Health.  Experience with Children.  Experience Administering Injections.  Special Education.  Algebra.  Anatomy Knowledge.  Teaching ,RN. LPN. CPR Certification. First Aid Certification. Professional Educator License. AED Certification. LVN. Physician Assistant License. BLS Certification. AHA Certification. Teaching Certification 
Registered Nurse (RN) ,Bachelor of Nursing,33.79 per hour,"39,000+",A registered nurse is a health care professional who assists doctors and other medical professionals with their patient care duties. They also manage and maintain medical records. Other tasks a registered nurse may perform include:,Conducting physical examinations to evaluate patient health issues. Directly administering care to injured sick disabled or recovering patients. Creating and enforcing nursing care plans. Educating patients regarding their medical conditions and the treatment plan they need to follow. Supervising other medical professionals such as other licensed nurses nursing aides and assistants. Ensuring a hygienic and hazard-free working environment. Providing patients and their families with emotional support. Running and analyzing certain medical tests. Helping doctors during medical procedures. Promoting healthy habits for patients and their families ,Medication Administration.  Nursing.  Acute Care.  Hospital Experience.  ICU Experience.  Home Care.  Critical Care Experience.  EMR Systems.  Workers' Compensation Law.  Hospice Care.  Tube Feeding.  Catheterization ,RN. BLS Certification. ACLS Certification. CPR Certification. Compact State Nurse License. PALS Certification. Emergency Nursing Pediatric Course. AHA Certification. TNCC Certification. NRP Certification. LPN. Certified Emergency Nurse 
Financial Controller ,"Bachelor in Business Administration (with emphasis in Finance), Bachelor in Economics",87222 per year,"24,000+",A financial controller uses advanced financial skills to analyze prepare and oversee financial reporting processes. They oversee all accounting practices within an organization and may make financial and budget recommendations to the organization's decision makers. Financial controllers have the following responsibilities: ,Recruit hire and train financial analyst team members. Prepare financial statements budgets and reports. Identify financial trends and make recommendations. Evaluate current budgets and identify ways to cut costs. Approve invoices and follow up with past-due accounts ,Accounting Software.  QuickBooks.  Accounting.  Sage.  Regulatory Reporting.  GAAP.  Workers' Compensation Law.  General Ledger Accounting.  Financial Management.  IFRS.  ERP Systems.  Budgeting ,CPA. Certified Management Accountant. Certified Investment Management Analyst. Chartered Financial Analyst. PMI Certification. Passenger Endorsement. FINRA License. Physician Assistant License. Certified Sommelier. Six Sigma Certification. Certified Defense Financial Manager 
Physiotherapist ,"Medical Degree in Biology, Bachelor in Physiotherapy",88478 per year ,"23,000+","Physiotherapists restore function and movement in people affected by injury disability or illness. Among the methods used by physiotherapists are exercise manual therapy clinical advice and education. Physiotherapy is based on a ""whole person"" approach to health improvement and well-being with particular attention given to the patient's lifestyle. It is a science-based discipline that relies heavily on the patient's involvement in their own care. Some of their primary duties include:",Help patients manage pain. Help prevent recurring illnesses and maintain overall patient health. Facilitate recovery and encourage physical improvement. Enable patients to continue working and leading better quality lives for as long as possible. Assess patients' conditions and implement treatment programs. Devise programs aimed at preventing physical dysfunction ,ICU Experience.  Critical Care Experience.  AJAX.  Case Management.  Communication Skills ,Physical Therapy License. BLS Certification. CPR Certification. First Aid Certification 
Physical Therapy Assistant ,"Medical Degree in Biology, Bachelor in Physiotherapy",31.02 per hour ,"24,000+",A physical therapy assistant is a healthcare professional responsible for carrying out patient treatment plans under the supervision of a physical therapist. They help with a variety of tasks including showing patients how to perform exercises using modalities on them and educating them about their injuries. Modalities are instruments of energy that may make physiological changes such as ultrasounds moist heat ice stimulation of muscles or traction devices. Physical therapy assistants also spend time documenting each treatment session accurately and may need to submit their treatment notes to insurance companies. Some of their primary duties include:,Verifying patients are performing their home exercises properly and correcting them if necessary. Communicating with the physical therapist to update exercise programs. Evaluating a patient's condition using medical and biological science. Teaching patients and their family how to take care of their injury after therapy finishes. Creating objectives and goals for treatment ,Home Care.  Physiology Knowledge.  Patient Service Experience.  Anatomy Knowledge.  Medical Office Experience.  Front Desk.  Heavy Lifting.  Office Experience.  Patient Assessment.  Pediatrics Experience.  Teaching.  Patient Care ,Licensed Physical Therapy Assistant. Physical Therapy License. CPR Certification. BLS Certification. Certified Athletic Trainer. AHA Certification. COTA. Massage Therapy License. CNA. Certified Personal Trainer. AED Certification 
Paralegal ,"Bachelor in Law, Bachelor in Business Administration (with emphasis in Business Law)",50261 per year,"27,000+",A paralegal is a legal professional who performs a variety of work for a lawyer. Paralegals help lawyers prepare for trials depositions and hearings and assist with preparing closing documents for cases. Their tasks vary depending on the size of their firm but commonly include: ,Drafting legal documents and reports requested by lawyers. Developing legal arguments motions and case filings with lawyers. Conducting case research using existing files and other relevant resources. Gathering case evidence including affidavits and formal statements. Maintaining and organizing legal files for ongoing and resolved cases. Monitoring pertinent changes to government regulations and guidelines ,Paralegal.  Legal Research.  Legal Drafting.  Litigation.  Leadership Experience.  Intellectual Property Law.  Filing.  UCC Law.  Contracts.  Microsoft Outlook.  Microsoft Word.  Word Processing ,Paralegal Certificate. Certified Notary Public. Non-CDL Class C. Bar. Water Certification. Certified Compensation Professional. School Bus Endorsement. RN. Certified Dental Assistant. CompTIA Certified Technical Trainer. Certified Anti-Money Laundering Specialist 
Manufacturing Engineer ,"Bachelor in Mechanical Engineering, Bachelor in Industrial Engineering, Bachelor in Process Engineering",77383 per year  ,"21,000+",Manufacturing engineers evaluate the process of manufacturing in a company identify potential improvements and create and implement solutions. They can work in many different types of facilities in any industry that manufactures products. Manufacturing engineer duties include: ,Studying existing manufacturing processes and identifying strengths and weaknesses. Identifying potential improvements in product design and assembly line processes. Designing new systems for a product including the design of entire factories. Creating protocols to improve optimization of the product line in technical and budgetary aspects. Designing new products. Working with design teams to create prototypes. Working with financial and marketing teams to provide them with information that will affect pricing and advertising decisions. Assisting with inventory control. Managing the procurement process for raw materials ,Lean Manufacturing.  Manufacturing.  Tooling.  SolidWorks.  Machining.  Six Sigma.  Lean.  CAD.  Kaizen.  Assembly Experience.  CNC Programming.  CNC ,Six Sigma Certification. Lean Six Sigma Certification. Lean Six Sigma Green Belt. Certified Quality Engineer. CAD Certification. Certified Welding Inspector. IPC-610 Certification. PMP. Six Sigma Master Black Belt. Certified Quality Auditor. AWS D1.1. Lean Six Sigma Black Belt 
Internal Auditor ,"Bachelor in Business Administration (with emphasis in Accounting and/or Finance), Bachelor in Economics",87308 per year  ,"24,000+",An internal auditor is a finance professional who provides independent and objective evaluations of financial and operational business activities. Internal auditors make sure the company complies with local state and national laws and regulations and that the company follows proper procedures and functions as efficiently as possible. Their main responsibility is to identify and correct any issues they discover to avoid issues during an external audit by government authorities. Some of an internal auditor's additional responsibilities may include: ,Maintaining and cultivating a master inventory of the company's policies practices and processes. Testing the operation and altering the design of existing financial controls to improve efficiency and customer care. Performing inquiries and testing as needed to identify and resolve any vulnerabilities. Creating and updating the internal audit plan by developing new audit programs to ensure adequate financial controls. Making recommendations to financial management about software policies and audit triggers ,Internal Audits.  SOX.  COSO.  COBIT.  Visio.  ISO 27001.  Data Analytics.  Financial Services.  Accounting.  Process Improvement.  Data Analysis Skills.  NIST Standards ,Certified Internal Auditor. Certified Information Systems Auditor. CPA. Certified Fraud Examiner. Certified Financial Services Auditor. CISSP. CGEIT. CRISC. Certified Anti-Money Laundering Specialist. CISM. Certification In Risk Management Assurance. Certified Government Auditing Professional 
Dental Hygienist ,Bachelor in Dentistry,38.20 per hour  ,"21,000+",Dental hygienists examine and clean patients' teeth. They typically offer preventive care to help patients avoid oral diseases and they also teach patients about maintaining good oral health. Dental hygienists perform the following tasks: ,Clean patients' teeth. Use ultrasonic toothbrushes to deeply clean and power polishing tools to eliminate stains. Use handheld implements to remove plaque and tartar. Examine patients' teeth and looking for signs of oral diseases. Monitor patients' oral health. Review patients' dental histories during each visit to ensure they are maintaining good oral health and following recommended treatment plans. Collaborate with other dentists,Infection Control Training.  Eaglesoft.  Dentrix.  EMR Systems.  Medical Imaging.  HIPAA.  Communication Skills.  Computer Skills.  Dental Office Experience.  Chairside Assisting.  Outside Sales.  OSHA ,Registered Dental Hygienist. Local Anesthesia Certification. Anesthesia Certification. Nitrous Oxide Certification. X-Ray Certification. CPR Certification. Radiology Certification. Sealant Certification. BLS Certification. Certified Dental Assistant. AHA Certification. Physician Assistant License 
Process Engineer ,"Bachelor in Chemical Engineering, Bachelor in Industrial Engineering",86944 per year  ,"21,000+",A process engineer is responsible for the equipment system and methods used in a manufacturing facility to transform raw ingredients to their final product form. This position is responsible for the smooth operation of production facilities plants and factories and often requires a mix of scientific and administrative skills. Some process engineer duties include: ,Testing monitoring and maintaining equipment including conducting regular tests to make sure equipment is in compliance with national and internal standards. Researching pricing and assisting in the purchase of new equipment. Designing new equipment as required or redesigning the flow of the process in the factory or plant. Designing modifying and overseeing processes to guarantee maximum output with minimum defects in the production line. Overseeing the operations of the plant . Overseeing the safety of employees. Writing maintaining and collecting required paperwork to show compliance with safety protocols. Collecting and interpreting data on efficiency and budgets to report to senior management. Analyzing every detail and step of the production process to cut costs increase productivity and optimize the production line ,Process Engineering.  Distributed Control Systems.  Manufacturing.  Six Sigma.  Lean Manufacturing.  Programmable Logic Controllers.  Continuous Improvement.  Root Cause Analysis.  Minitab.  CGMP.  Process Improvement.  Kaizen ,Six Sigma Certification. Lean Six Sigma Green Belt. Lean Six Sigma Certification. Professional Engineer. Molder Certification. Certified Quality Engineer. IPC-610 Certification. PMP. Lean Six Sigma Black Belt. TWIC Card. CTBS. ITIL Certification 
Industrial Engineer ,Bachelor in Industrial Engineering,73786 per year  ,"22,000+",Industrial engineers work with machines and systems to improve the efficiency of a company. An industrial engineer may work in production or manufacturing and will find ways to cut costs improve productivity and maximize the organization's output. An industrial engineer may have the following responsibilities: ,Evaluate productivity and offer recommendations to improve procedures. Assess machinery and identify ways to improve its efficiency. Develop quality control standards and regularly test and report on results. Predict and improve financial planning for industrial equipment. Monitor employee schedules and tasks and make improvements to meet demands ,Industrial Engineering.  Lean Manufacturing.  GM Vehicles.  Manufacturing.  Lean.  Six Sigma.  Kaizen.  Continuous Improvement.  Assembly Experience.  Value Stream Mapping.  AutoCAD.  Warehouse Management System ,Six Sigma Certification. Lean Six Sigma Black Belt. Lean Six Sigma Green Belt. Lean Six Sigma Certification. Six Sigma Master Black Belt. Professional Engineer. Certified Welding Inspector. Fundamentals of Engineering. LEED Certification. AWS D1.1. Certified Safety Professional 
Data Analyst ,"Bachelor in Mathematics and Statistics, Bachelor in Computer Science, Bachelor in Computer Engineering",64791 per year,"25,000+",Data analysts organize and interpret large amounts of data for others to easily understand. Business professionals use this interpreted data to make business decisions. Data analysts also have the following responsibilities: ,Complete statistical tests to gather data related to business procedures. Translate large amounts of data into easy-to-read reports. Identify important trends that can influence business decisions. Routinely monitor data for industry changes. Collaborate with team members to improve statistical testing procedures ,Data Analysis Skills.  Tableau.  SQL.  Data Mining.  Power BI.  SAS.  R.  Data Management.  Data Visualization.  Data Analytics.  Microsoft Access.  Analytics ,PMP. ITIL Certification. Six Sigma Certification. CAPM. Certified Dental Assistant. CISSP. CCBA. CompTIA Security+. CBAP. IAT Level II. RCDD. Epic Certification 
Buyer ,0,62799 per year  ,"38,000+",A buyer is a finance and business professional who investigates evaluates and purchases products for companies to sell or use in their own operations. Also known as purchasing agents buyers must work within a budget and often have to negotiate competitive pricing for the items they want to purchase. Here are some additional responsibilities of a buyer: ,Selecting and ordering products and authorizing payments based on contractual agreements with suppliers or manufacturers. Assisting supply chain managers with maintaining proper inventory levels for regularly used supplies. Working with inventory management to ensure all deliveries are fulfilled and reporting any missing or back-ordered items. Communicating with the field management team to ensure all field purchase orders are correct. Developing an accurate and efficient monitoring system for open purchase orders and delivering weekly reports to management with documentation of closed purchase orders ,Purchasing.  Procurement.  MRP.  Negotiation.  ERP Systems.  Sourcing.  HR Sourcing.  Manufacturing.  Contracts.  SAP.  Supply Chain Experience.  Inventory Control ,Real Estate License. CPIM. Certified Purchasing Manager. Certified Supply Chain Professional. APICS Certification. Real Estate Broker. Lean Six Sigma Certification. Six Sigma Certification. Lean Six Sigma Yellow Belt. CPPB. Pharmacy Technician Certification 
Pathologist ,Medical Degree in Biology,120643 per year,"17,000+",A pathologist is a medical doctor with a dedication to studying the causes indicators cures and effects of various diseases. Some of the duties pathologists typically have include: ,Studying bodily fluids and tissues to determine the cause of a patient's ailments. Working with imaging specialists to create analysis algorithms based on laboratory samples. Conducting tissue biopsies to determine whether a tissue sample is benign or cancerous. Collating data from multiple sources into single clinical studies. Performing autopsies to gather information about a disease's genetic progression and growth. Conducting analyses of the clinical data available to reach more definitive conclusions Analyzing genetic material and testing for potentially effective treatments for conditions based on genetic information. Supervising physical examinations on a patient to offer recommendations on actions a patient can take to maintain health and cure illnesses , , 
Clinical Social Worker ,0,41.00 per hour ,"21,000+",Clinical social workers are professionals licensed to diagnose and treat people with behavioral mental and emotional disorders. They work with clients to change damaging behaviors or manage challenges in their lives. Conditions clinical social workers might treat include anxiety depression eating disorders addiction and more. Some specialize in certain areas such as criminal justice or child welfare. Others treat specific populations such as military personnel students children elderly or families. Some of their primary duties include:,Meeting with clients to assess their histories conditions and needs. Interviewing clients' families and doctors. Creating a treatment strategy using methods such as behavior therapy and psychotherapeutic techniques. Collaborating with doctors other health professionals and support groups. Monitoring clients' responses to treatment. Administrative and record-keeping duties. Counseling individuals and families going through difficult situations such as illness divorce unemployment or substance abuse ,Social Work.  Hospice Care.  Case Management.  Behavioral Health.  Addiction Counseling.  Motivational Interviewing.  Intake Experience.  Crisis Intervention.  Child Welfare.  Experience with Children.  Home Care.  Acute Care ,Clinical Social Worker. LMSW. Social Work License. LSW. Licensed Clinical Social Worker. LASW. Certified Social Worker. LICSW. LBSW. Professional Educator License. LISW. LSWAA 
Charge Nurse ,Bachelor of Nursing,24.29 per hour  ,"28,000+",Charge nurses manage a ward in a hospital or other healthcare facility. They are experienced nurses who delegate tasks to other staff in their unit. Charge nurses may do a combination of the following tasks: ,Coordinate with physicians who need assistance. Detect patient issues that could result in injuries or other difficulties. Prepare and maintain schedules. Monitor admissions and discharges. Order and monitor supplies. Oversee policy safety and procedure compliance,HTTPS.  Tube Feeding.  Medication Administration.  Physiology Knowledge.  Nursing.  Catheterization.  Anatomy Knowledge.  Employee Evaluation.  Dialysis Experience.  Supervising Experience.  Nursing Home Experience.  Physical Examinations ,LPN. LVN. RN. CPR Certification. BLS Certification. ACLS Certification. CNA. Compact State Nurse License. PALS Certification. CCRN Certification. AHA Certification. IV Certification 
Staff Accountant ,Bachelor in Business Administration (with emphasis in Accounting),51249 per year,"20,000+",Staff accountants handle basic accounting tasks like financial reporting budget preparation and general bookkeeping for an organization. Many professionals in this position prepare tax returns and some also manage accounts payable and receivable. Staff accountants typically work under experienced professionals like controllers or certified public accountants. As a staff accountant you can expect to fulfill the following responsibilities: ,Maintain records and create accounting entries for the organization's journals and registers. Create general ledger entries and reconcile accounts. Prepare financial statements at the end of each month. Gather data from the general ledger to produce financial statements. Provide transaction details. Analyze internal procedures. Recommend improvements to reduce costs or labor. Review existing workflows and test new methods. Assist with audits. Review financial details to translate data into new ledger formats,Accounting.  QuickBooks.  Account Reconciliation.  General Ledger Accounting.  General Ledger Reconciliation.  Accounting Software.  Microsoft Dynamics GP.  Sage.  GAAP.  Balance Sheet Reconciliation.  Pivot Tables.  Account Analysis ,CPA. Certified Management Accountant. Enrolled Agent. Certified Bookkeeper. PERC Card. Certified Internal Auditor. Certified Investment Management Analyst. Non-CDL Class C. Certified Government Financial Manager. Certified Valuation Analyst. Childcare Certification 
